{
  "version": "1.0",
  "pmid": "29961255",
  "timestamp": 1761140011479,
  "data": {
    "pmid": "29961255",
    "title": "Transcriptome Profiling of Single Mouse Oocytes.",
    "authors": [
      "Borensztein M",
      "Syx L",
      "Servant N",
      "Heard E"
    ],
    "journal": "Methods Mol Biol",
    "publicationDate": "2018",
    "volume": "1818",
    "issue": "",
    "pages": "51-65",
    "abstract": "1. Methods Mol Biol. 2018;1818:51-65. doi: 10.1007/978-1-4939-8603-3_7.\n\nTranscriptome Profiling of Single Mouse Oocytes.\n\nBorensztein M(1), Syx L(2), Servant N(3), Heard E(2).\n\nAuthor information:\n(1)Institut Curie, PSL Research University, CNRS UMR3215, INSERM U934, UPMC \nParis-Sorbonne, Paris, 75005, France. maud.borensztein@curie.fr.\n(2)Institut Curie, PSL Research University, CNRS UMR3215, INSERM U934, UPMC \nParis-Sorbonne, Paris, 75005, France.\n(3)Institut Curie, PSL Research University, Mines Paris Tech, INSERM U900, \nParis, 75005, France. nicolas.servant@curie.fr.\n\nSingle-cell RNA-sequencing (scRNAseq) enables the detection and quantification \nof mature RNAs in an individual cell. Assessing single cell transcriptomes can \ncircumvent the limited amount of starting material obtained in oocytes or \nembryos, in particular when working with mutant mice. Here we outline our \nscRNAseq protocol to study mouse oocyte transcriptomes, derived from Tang et \nal., Nat Methods 6(5):377-382, 2009 . The method describes the different steps \nfrom single cell isolation and cDNA amplification to high-throughput sequencing. \nThe bioinformatics pipeline used to analyze and compare genome-wide gene \nexpression between individual oocytes is then described.\n\nDOI: 10.1007/978-1-4939-8603-3_7\nPMID: 29961255 [Indexed for MEDLINE]",
    "doi": "doi: 10.1007/978-1-4939-8603-3_7",
    "url": "https://pubmed.ncbi.nlm.nih.gov/29961255/",
    "publicationTypes": [
      "Journal Article"
    ],
    "meshTerms": [],
    "keywords": []
  }
}