{
  "version": "1.0",
  "pmid": "40473992",
  "timestamp": 1761140184400,
  "data": {
    "pmid": "40473992",
    "title": "High-definition spatial transcriptomic profiling of immune cell populations in colorectal cancer.",
    "authors": [
      "Oliveira MF",
      "Romero JP",
      "Chung M",
      "Williams SR",
      "Gottscho AD",
      "Gupta A",
      "Pilipauskas SE",
      "Mohabbat S",
      "Raman N",
      "Sukovich DJ",
      "Patterson DM",
      "Visium HD Development Team",
      "Taylor SEB"
    ],
    "journal": "Nat Genet",
    "publicationDate": "2025 Jun",
    "volume": "57",
    "issue": "6",
    "pages": "1512-1523",
    "abstract": "1. Nat Genet. 2025 Jun;57(6):1512-1523. doi: 10.1038/s41588-025-02193-3. Epub\n2025  Jun 5.\n\nHigh-definition spatial transcriptomic profiling of immune cell populations in \ncolorectal cancer.\n\nOliveira MF(#)(1), Romero JP(#)(1), Chung M(#)(1), Williams SR(1), Gottscho \nAD(1), Gupta A(1), Pilipauskas SE(1), Mohabbat S(1), Raman N(1), Sukovich DJ(1), \nPatterson DM(1); Visium HD Development Team; Taylor SEB(2).\n\nCollaborators: de Oliveira MF, Romero JP, Williams SR, Patterson DM, Taylor SEB.\n\nAuthor information:\n(1)10x Genomics, Inc, Pleasanton, CA, USA.\n(2)10x Genomics, Inc, Pleasanton, CA, USA. sarah.taylor@10xgenomics.com.\n(#)Contributed equally\n\nA comprehensive understanding of cellular behavior and response to the tumor \nmicroenvironment (TME) in colorectal cancer (CRC) remains elusive. Here, we \nintroduce the high-definition Visium spatial transcriptomic technology (Visium \nHD) and investigate formalin-fixed paraffin-embedded human CRC samples (n = 5). \nWe demonstrate the high sensitivity, single-cell-scale resolution and spatial \naccuracy of Visium HD, generating a highly refined whole-transcriptome spatial \nprofile of CRC samples. We identify transcriptomically distinct macrophage \nsubpopulations in different spatial niches with potential pro-tumor and \nanti-tumor functions via interactions with tumor and T cells. In situ gene \nexpression analysis validates our findings and localizes a clonally expanded T \ncell population close to macrophages with anti-tumor features. Our study \ndemonstrates the power of high-resolution spatial technologies to understand \ncellular interactions in the TME and paves the way for larger studies that will \nunravel mechanisms and biomarkers of CRC biology, improving diagnosis and \ndisease management strategies.\n\n© 2025. The Author(s).\n\nDOI: 10.1038/s41588-025-02193-3\nPMCID: PMC12165841\nPMID: 40473992 [Indexed for MEDLINE]\n\nConflict of interest statement: Competing interests: All authors are current or \nformer employees or shareholders of 10x Genomics.",
    "doi": "doi: 10.1038/s41588-025-02193-3",
    "url": "https://pubmed.ncbi.nlm.nih.gov/40473992/",
    "publicationTypes": [
      "Journal Article"
    ],
    "meshTerms": [],
    "keywords": []
  }
}